Topic,Top Words,Interpretation
Topic 0,"guys, love, just, thanks, great, jetblue, virginamerica, thank, united, southwestair",Positive feedback / praise
Topic 1,"dont, jfk, fly, thanks, im, home, just, usairways, flight, jetblue",Flight info / neutral tweets
Topic 2,"southwestair, help, hours, cancelled, customer, flight, service, hold, usairways, americanair",Complaints / customer service issues
Topic 3,"thanks, flights, southwestair, time, flightled, delayed, late, cancelled, flight, united",Flight delays / operational issues
Topic 4,"hour, help, number, aa, plane, thanks, gate, flight, usairways, americanair",Airport assistance / queries
